ColorId,ColorNombre,descripcion;;;;;;;;
1,MARRON, sin descripcion;;;;;;;;
2,NEGRO, sin descripcion;;;;;;;;
3,GRIS, sin descripcion;;;;;;;;
4,BLANCO CON MANCHAS NEGRAS, sin descripcion;;;;;;;;
5,MANTO NEGRO, sin descripcion;;;;;;;;
6,ATIGRADO, sin descripcion;;;;;;;;
7,BLANCO CON MANCHAS MARRONES, sin descripcion;;;;;;;;
8,BLANCO, sin descripcion;;;;;;;;
9,DORADO, sin descripcion;;;;;;;;
10,BEIGE, sin descripcion;;;;;;;;
11,CEBRITA, sin descripcion;;;;;;;;
12,GRIS/BLANCO, sin descripcion;;;;;;;;
13,MARRON/NEGRO, sin descripcion;;;;;;;;
14,AMARILLO, sin descripcion;;;;;;;;
15,BARCINO, sin descripcion;;;;;;;;
16,ATIGRADO Y BLANCO, sin descripcion;;;;;;;;
17,BAYO, sin descripcion;;;;;;;;
18,MANTO CLARO, sin descripcion;;;;;;;;
19,BLUE POINT, sin descripcion;;;;;;;;
20,SEAL POINT, sin descripcion;;;;;;;;
21,CHAMPAGNE, sin descripcion;;;;;;;;
22,TRICOLOR, sin descripcion;;;;;;;;
23,CHOCOLATE, sin descripcion;;;;;;;;
24,NEGRO Y BLANCO, sin descripcion;;;;;;;;
25,PELIROJO, sin descripcion;;;;;;;;
26,APRICOT, sin descripcion;;;;;;;;
27,SAL Y PIMIENTA, sin descripcion;;;;;;;;
28,BLANCO Y NEGRO, sin descripcion;;;;;;;;
29,NEGRO Y FUEGO, sin descripcion;;;;;;;;
30,MARRON Y BCO, sin descripcion;;;;;;;;
31,AMARILLA, sin descripcion;;;;;;;;
32,BLANCO Y GRIS, sin descripcion;;;;;;;;
33,NEGRA, sin descripcion;;;;;;;;
34,AMARILLO Y BCO, sin descripcion;;;;;;;;
35,BARCINO Y BLANCO, sin descripcion;;;;;;;;
36,MARRON Y B, sin descripcion;;;;;;;;
37,NEG, sin descripcion;;;;;;;;
38,BLANCO Y MARRON, sin descripcion;;;;;;;;
39,MARRON Y NEGRO, sin descripcion;;;;;;;;
40,MARRON Y BLANCO, sin descripcion;;;;;;;;
41,BLANCO Y AMARILLO, sin descripcion;;;;;;;;
42,GRIS Y BCO, sin descripcion;;;;;;;;
43,BLANCO MARRON Y NGO, sin descripcion;;;;;;;;
44,NEGRO Y MARRON, sin descripcion;;;;;;;;
45,BARCINA, sin descripcion;;;;;;;;
46,AMARILLO Y NEGRO, sin descripcion;;;;;;;;
47,GRIS Y BLANCO, sin descripcion;;;;;;;;
48,BCO Y GRIS, sin descripcion;;;;;;;;
49,NEGRO Y GRIS, sin descripcion;;;;;;;;
50,NARANJA, sin descripcion;;;;;;;;
51,GRIS ATIGRADO, sin descripcion;;;;;;;;
52,GRIS Y ATIGRADO, sin descripcion;;;;;;;;
53,NEGRO Y BCO, sin descripcion;;;;;;;;
54,ATIGRADO AMARILLO, sin descripcion;;;;;;;;
55,BAYO Y BLANCO, sin descripcion;;;;;;;;
56,NEGRO Y B, sin descripcion;;;;;;;;
57,ARLEQUIN, sin descripcion;;;;;;;;
58,MARRON CLARO, sin descripcion;;;;;;;;
59,MARR, sin descripcion;;;;;;;;
60,PLATEADO, sin descripcion;;;;;;;;
61,NEGRO Y BEIGE, sin descripcion;;;;;;;;
62,BLANCO Y BEIGE, sin descripcion;;;;;;;;
63,VERDE, sin descripcion;;;;;;;;
64,CAREY, sin descripcion;;;;;;;;
65,AMARLLO, sin descripcion;;;;;;;;
66,NEGRO Y AMARILLO, sin descripcion;;;;;;;;
67,NEGRO Y BL, sin descripcion;;;;;;;;
68,GRIS Y B, sin descripcion;;;;;;;;
69,GRIS Y NEGRO, sin descripcion;;;;;;;;
70,BLANCO PIRATA, sin descripcion;;;;;;;;
71,CHOCOLATE Y BLANCO, sin descripcion;;;;;;;;
72,DORADO Y BLANCO, sin descripcion;;;;;;;;
73,BEIGE Y NEGRO, sin descripcion;;;;;;;;
74,MARRON OSCURO, sin descripcion;;;;;;;;
75,CHOCOLATE POINT, sin descripcion;;;;;;;;
76,TE CON LECHE, sin descripcion;;;;;;;;
77,RUANO DORADO, sin descripcion;;;;;;;;
78,MANTO MARRON, sin descripcion;;;;;;;;
79,VERDE Y NARANJA, sin descripcion;;;;;;;;
80,RED POINT, sin descripcion;;;;;;;;
81,CAREY POINT, sin descripcion;;;;;;;;
82,RUANO NEGRO, sin descripcion;;;;;;;;
83,TABY POINT, sin descripcion;;;;;;;;
84,BARCINO GRIS, sin descripcion;;;;;;;;
85,CAREY GRIS, sin descripcion;;;;;;;;
86,SMOKE, sin descripcion;;;;;;;;
87,FAWN POINT, sin descripcion;;;;;;;;
88,BARCINO MARMOLADO, sin descripcion;;;;;;;;
89,BARCINO GRIS Y BLANCO, sin descripcion;;;;;;;;
90,COLORADA, sin descripcion;;;;;;;;
91,BLANCO Y BARCINO, sin descripcion;;;;;;;;
92,BEIGE Y BLANCO, sin descripcion;;;;;;;;
93,BLANCO Y ATIGRADO, sin descripcion;;;;;;;;
94,BATARASA, sin descripcion;;;;;;;;
95,CRUZA BOXER, sin descripcion;;;;;;;;
96, AZUL, sin descripcion;;;;;;;;
97,CELESTE, sin descripcion;;;;;;;;
98,BARCINO CAREY, sin descripcion;;;;;;;;
99,ALBINO, sin descripcion;;;;;;;;
100,NEGRO Y ATIGRADO, sin descripcion;;;;;;;;
101,AGUTI, sin descripcion;;;;;;;;
102,AMARILLO BARCINO MARMOLADO, sin descripcion;;;;;;;;
103,CRUZA SCHNAUZER, sin descripcion;;;;;;;;
104,AZUL Y BLANCO, sin descripcion;;;;;;;;
105,GRIS Y BEIGE, sin descripcion;;;;;;;;
